{
  "metadataType": "MyApplication",
  "createdBy": "创建人",
  "createdOn": "2023-06-20T17:22:01.2935753+08:00",
  "modifiedBy": "修改人",
  "modifiedOn": "2023-06-20T19:21:00.6857054+08:00",
  "applicationGuid": "be41b639-8c95-4afd-980f-61a8411bb1d4",
  "applicationName": "AI-财务管理",
  "application": "x_3825",
  "shortName": "finan_wSdl",
  "description": "汇总集团以及集团下各子公司相应的报销、资金往来、个人借还款、工程付款等等表单流程数据，并且其中工程付款与工程预算以及工程采购之间也有相对应数据之间的联动业务，在实现财务数据统一的前提下，也很好的做到了各应用间的数据更新。"
}